,UF,Instituição de ensino,Contagem,Porcentagem
0,ES,Universidade Federal do Espírito Santo,151,6.18%
1,SP,Universidade Estadual de Campinas,121,4.95%
2,MA,Universidade Federal do Maranhão,69,2.83%
3,RJ,Universidade do Estado do Rio de Janeiro,67,2.74%
4,PR,Universidade Estadual de Londrina,64,2.62%
5,PE,Universidade Federal do Vale do São Francisco,61,2.50%
6,SP,Universidade Federal do ABC,59,2.42%
7,AM,Universidade Federal do Amazonas,58,2.38%
8,BA,Universidade do Estado da Bahia,55,2.25%
9,DF,Universidade de Brasília,53,2.17%
10,BA,Universidade Estadual de Santa Cruz,53,2.17%
11,RJ,Universidade Estadual do Norte Fluminense,47,1.92%
12,CE,Universidade Estadual do Ceará,46,1.88%
13,RS,Universidade federal do Rio Grande do Sul,46,1.88%
14,BA,Universidade Federal do Sul da Bahia,46,1.88%
15,PR,Universidade Estadual do Oeste do Paraná,45,1.84%
16,MG,Universidade Federal de Lavras,41,1.68%
17,MG,Centro Federal de Educação Tecnológica de Minas Gerais,40,1.64%
18,BA,Universidade Estadual de Feira de Santana,40,1.64%
19,PE,Universidade Federal Rural de Pernambuco,40,1.64%
20,AC,Universidade Federal do Acre,38,1.56%
21,MT,Universidade do Estado de Mato Grosso,37,1.52%
22,RS,Universidade Federal de Pelotas,37,1.52%
23,PR,Universidade Estadual de Maringá,36,1.47%
24,RJ,Universidade Federal do Rio de Janeiro,35,1.43%
25,PR,Universidade Tecnológica Federal do Paraná,34,1.39%
26,PR,Universidade Estadual do Paraná,33,1.35%
27,MS,Universidade Federal da Grande Dourados,31,1.27%
28,PI,Universidade Federal do Piauí,31,1.27%
29,MS,Universidade Federal de Mato Grosso do Sul,30,1.23%
30,MG,Universidade Federal de Viçosa,29,1.19%
31,PR,Universidade Federal da Integração Latino-Americana,28,1.15%
32,RO,Universidade Federal de Rondônia,28,1.15%
33,MG,Universidade Federal de São João del-Rei,28,1.15%
34,RS,Universidade Federal de Santa Maria,27,1.11%
35,MT,Universidade Federal do Mato Grosso,27,1.11%
36,PA,Universidade do Estado do Pará,26,1.06%
37,PI,Instituto Federal do Piauí,24,0.98%
38,AL,Universidade Federal de Alagoas,24,0.98%
39,RJ,Universidade Federal Rural do Rio de Janeiro,24,0.98%
40,CE,Universidade Estadual do Vale do Acaraú,24,0.98%
41,SP,Universidade de São Paulo,23,0.94%
42,RJ,Centro Federal de Educação Tecnológica Celso Suckow da Fonseca,22,0.90%
43,BA,Universidade Estadual do Sudoeste da Bahia,22,0.90%
44,CE,Universidade Federal do Ceará,22,0.90%
45,RS,Instituto Federal do Rio Grande do Sul,21,0.86%
46,PR,Universidade Estadual de Ponta Grossa,21,0.86%
47,MG,Universidade Federal de Juiz de Fora,21,0.86%
48,MG,Universidade Federal de Uberlândia,21,0.86%
49,RJ,Fundação de Apoio à Escola Técnica do Estado do Rio de Janeiro,20,0.82%
50,SC,Universidade do Estado de Santa Catarina,20,0.82%
51,PR,Universidade Federal do Paraná,19,0.78%
52,MT,Universidade Federal de Rondonópolis,17,0.70%
53,GO,Universidade Estadual de Goiás,17,0.70%
54,SE,Universidade Federal de Sergipe,17,0.70%
55,PB,Universidade Estadual da Paraíba,16,0.66%
56,PA,Universidade Federal Rural da Amazônia,15,0.61%
57,PA,Universidade Federal do Oeste do Pará,14,0.57%
58,CE,Universidade Regional do Cariri,14,0.57%
59,PE,Universidade de Pernambuco,13,0.53%
60,GO,Universidade Federal de Goiás,12,0.49%
61,RJ,Universidade Federal Fluminense,12,0.49%
62,DF,Universidade do Distrito Federal,11,0.45%
63,PI,Universidade Estadual do Piauí,11,0.45%
64,MG,Universidade Federal de Ouro Preto,11,0.45%
65,AP,Universidade Federal do Amapá,11,0.45%
66,SP,Universidade Federal de São Carlos,11,0.45%
67,RR,Universidade Federal de Roraima,10,0.41%
68,MS,Universidade Estadual de Mato Grosso do Sul,9,0.37%
69,PR,Universidade Estadual do Norte do Paraná,9,0.37%
70,PB,Universidade Federal da Paraíba,9,0.37%
71,RS,Universidade Federal de Rio Grande,9,0.37%
72,AM,Universidade do Estado do Amazonas,8,0.33%
73,BA,Universidade Federal da Bahia,8,0.33%
74,BA,Universidade Federal do Oeste da Bahia,8,0.33%
75,PA,Universidade Federal do Pará,8,0.33%
76,MG,Universidade Federal dos Vales do Jequitinhonha e Mucuri,8,0.33%
77,BA,Universidade Federal do Recôncavo da Bahia,7,0.29%
78,RR,Universidade Estadual de Roraima,5,0.20%
79,PR,Universidade Estadual do Centro-Oeste,5,0.20%
80,SC,Universidade Federal da Fronteira Sul,5,0.20%
81,PE,Universidade Federal de Pernambuco,5,0.20%
82,SP,Universidade Federal de São Paulo,5,0.20%
83,RN,Universidade Federal do Rio Grande do Norte,5,0.20%
84,RJ,Universidade Federal do Estado do Rio de Janeiro,4,0.16%
85,MG,Universidade do Estado de Minas Gerais,3,0.12%
86,GO,Universidade Federal de Catalão,3,0.12%
87,PR,Instituto Federal do Paraná,3,0.12%
88,CE,Universidade da Integração Internacional da Lusofonia Afro-Brasileira,2,0.08%
89,TO,Universidade de Guripi,2,0.08%
90,PB,Universidade Federal de Campina Grande,2,0.08%
91,PI,Universidade Federal do Delta do Parnaíba,2,0.08%
92,PA,Universidade Federal do Sul e Sudeste do Pará,2,0.08%
93,TO,Universidade federal do Tocantins,2,0.08%
94,PE,Universidade Federal do Agreste de Pernambuco,2,0.08%
95,GO,Instituto Federal de Goiás,2,0.08%
96,SP,Faculdade de Medicina de Jundiaí,1,0.04%
97,ES,Faculdade de Música do Espírito Santo,1,0.04%
98,RJ,Fundação Centro de Ciências e Educação Superior a Distância do Estado do Rio de Janeiro,1,0.04%
99,MG,Instituto Federal do Sudeste Mineiro,1,0.04%
100,SP,rede municipal de Diadema,1,0.04%
101,RJ,Secretaria de Educação do Rio de Janeiro,1,0.04%
102,SP,Universidade Nove de Julho,1,0.04%
103,RS,Universidade de Santa Cruz do sul,1,0.04%
104,MA,Universidade estadual da região Tocantina do Maranhão,1,0.04%
105,MG,Universidade Estadual de Montes Claros,1,0.04%
106,MA,Universidade Estadual do Maranhão,1,0.04%
107,MS,Universidade Federal da Grande Dourados,1,0.04%
108,MG,Universidade Federal de Itajubá,1,0.04%
109,SC,Universidade Federal de Santa Catarina,1,0.04%
110,TO,Universidade Federal do Norte de Tocantins,1,0.04%
111,RS,Universidade Federal do Pampa,1,0.04%
112,RN,Universidade Federal Rural do Semi-Árido,1,0.04%
113,MG,Universidade Federal do Triângulo Mineiro,1,0.04%
114,MG,Instituto Federal de Minas Gerais,1,0.04%
115,PA,Instituto Federal do Pará,1,0.04%
116,CE,Instituto Federal do Ceará,1,0.04%
117,RJ,Instituto Federal Fluminense,1,0.04%
118,RO,Instituto Federal de Rondônia,1,0.04%
